keyword,cluster,same
40계단 문화관,1,싸다 비좁다 습하다 무섭다 눈부시다 알차다 싫다 멋있다 시끄럽다 슬프다 급하다 인상깊다 즐겁다 드넓다 가볍다 활기차다 낯설다 가파르다 젊다 어렵다 아쉬우다 붉다 맑다 비싸다 힘드다 덩그러다 빠르다 어둡다 아깝다 낮다 이쁘다 심심찮다 밝다 파랗다 빡세다 가깝다 남다르다 힘차다 덥다 좁다 얕다 깊다 야무지다 환하다 정신없다 정겹다 수많다 멀다 유례없다 적다 새롭다 흔하다 귀엽다 아름답다 두껍다 흥겹다 낡다 재미있다 어이없다 멋지다 뜨겁다 어지럽다 우습다
벡스코(BEXCO),1,싸다 무섭다 알차다 싫다 멋있다 무겁다 급하다 노랗다 엄청나다 외롭다 사이좋다 젊다 못지않다 어렵다 느리다 차다 맑다 묘하다 빠르다 낮다 가깝다 동그랗다 좁다 덥다 깊다 환하다 야무지다 반갑다 가파르다 멀다 춥다 적다 두껍다 수많다 귀엽다 아름답다 뛰어나다 고르다 안타깝다 낡다 뜻깊다 재미있다 이쁘다 후하다 즐겁다
부산자유회관(부산통일관),1,싸다 비좁다 예뻤다 재빠르다 무섭다 지겹다 알차다 싫다 귀여우다 멋있다 놀랍다 무겁다 급하다 가볍다 낯설다 외롭다 젊다 따사롭다 어렵다 벅차다 아쉬우다 차다 따갑다 맑다 비싸다 빠르다 아깝다 거세다 이쁘다 밝다 가깝다 그립다 거칠다 얕다 덥다 좁다 깊다 부끄럽다 멀다 춥다 올곧다 적다 손쉽다 새롭다 수많다 귀엽다 낫다 곧다 아름답다 고르다 안타깝다 재미있다 멋지다 뜨겁다 볼품없다 즐겁다
부산광역시 영도도서관,1,무섭다 틀림없다 알차다 싫다 귀여우다 오래다 멋있다 시끄럽다 슬프다 급하다 가볍다 엄청나다 젊다 못지않다 험하다 어렵다 아쉬우다 느리다 짙다 맑다 붉다 드물다 비싸다 차갑다 빠르다 아깝다 거세다 낮다 이쁘다 밝다 가깝다 좁다 덥다 손색없다 빨갛다 깊다 야무지다 반갑다 가파르다 정겹다 수많다 멀다 춥다 알맞다 적다 새롭다 귀엽다 아름답다 안타깝다 굳세다 뜻깊다 재미있다 멋지다 뜨겁다 푸르르다
이바구공작소,1,싸다 습하다 무섭다 알차다 싫다 걸맞다 고되다 멋있다 귀여우다 정답다 곱다 가볍다 앙증맞다 엄청나다 젊다 못지않다 힘겹다 어렵다 느리다 드럽다 맑다 붉다 비싸다 힘드다 덩그러다 빠르다 폭넓다 낮다 이쁘다 밝다 가깝다 얕다 좁다 덥다 동그랗다 깊다 반갑다 가파르다 정겹다 멀다 적다 까다롭다 새롭다 수많다 아름답다 낫다 안타깝다 낡다 재미있다 귀엽다 멋지다 뜨겁다 즐겁다
부산 스마트시티 전시관,1,싸다 무섭다 알차다 싫다 미끄럽다 놀랍다 촌스럽다 급하다 드넓다 가볍다 활기차다 앙증맞다 하얗다 젊다 못지않다 어렵다 아쉬우다 더럽다 드럽다 맑다 붉다 드물다 비싸다 짙다 빠르다 쎄다 어둡다 아깝다 드높다 따숩다 이쁘다 어려우다 심심찮다 밝다 그립다 희다 낮다 파랗다 가깝다 힘차다 덥다 좁다 빨갛다 얕다 야무지다 반갑다 깊다 수많다 멀다 까맣다 춥다 적다 새롭다 엄청나다 귀엽다 아름답다 고르다 뜻깊다 재미있다 색다르다 멋지다 뜨겁다 즐겁다 정신없다
SEA LIFE 부산아쿠아리움,1,싸다 재빠르다 무섭다 지겹다 알차다 싫다 귀여우다 멋있다 촌스럽다 사납다 슬프다 급하다 즐겁다 활기차다 앙증맞다 사이좋다 못지않다 어렵다 아쉬우다 느리다 징그럽다 붉다 차갑다 비싸다 매섭다 빠르다 어둡다 바르다 이쁘다 하찮다 밝다 그립다 얕다 좁다 깊다 감쪽같다 야무지다 반갑다 멀다 춥다 알맞다 적다 새롭다 수많다 귀엽다 아름답다 뛰어나다 엄청나다 재미있다 멋지다 뜨겁다 재미없다 어지럽다 정신없다
뮤지엄 원,1,흔하다 싸다 습하다 무섭다 알차다 싫다 오래다 멋있다 냅다 놀랍다 무겁다 급하다 인상깊다 가볍다 엄청나다 젊다 어렵다 가까우다 맑다 붉다 비싸다 빠르다 과하다 커다랗다 아깝다 낮다 밝다 가깝다 좁다 덥다 깊다 야무지다 반갑다 멀다 춥다 적다 새롭다 수많다 귀엽다 아름답다 더우다 고르다 조그맣다 뜻깊다 어이없다 재미있다 멋지다 이쁘다 색다르다 후하다 즐겁다 정신없다
피아크 P.ARK,1,싸다 알차다 싫다 걸맞다 추우다 멋있다 시끄럽다 급하다 드넓다 가볍다 쨍하다 젊다 어렵다 아쉬우다 맑다 비싸다 빠르다 어둡다 아깝다 낮다 밝다 가깝다 뜨겁다 좁다 덥다 깊다 야무지다 가파르다 수많다 멀다 춥다 적다 엄청나다 귀엽다 낫다 찹다 더우다 아름답다 용하다 고르다 재미있다 뛰어나다 이쁘다 푸르르다 즐겁다
놀이마루,1,싸다 기쁘다 재빠르다 무섭다 눈부시다 알차다 싫다 오래다 멋있다 시끄럽다 놀랍다 곱다 사납다 급하다 재미나다 가볍다 예뿌다 외롭다 엄청나다 하얗다 젊다 못지않다 어렵다 가까우다 어두다 맑다 붉다 비싸다 해맑다 힘드다 빠르다 쎄다 어둡다 낮다 이쁘다 하찮다 밝다 파랗다 가깝다 희다 뜨거우다 좁다 덥다 얕다 빨갛다 깊다 야무지다 반갑다 환하다 수많다 멀다 춥다 적다 손쉽다 새롭다 귀엽다 낫다 아름답다 낡다 재미있다 멋지다 뜨겁다 재미없다 즐겁다
아난티코브 야외공연장,1,흔하다 싸다 알차다 싫다 추우다 멋있다 두렵다 놀랍다 촌스럽다 급하다 인상깊다 노랗다 드넓다 가볍다 엄청나다 어렵다 아쉬우다 차다 벌겋다 짙다 맑다 붉다 비싸다 차갑다 빠르다 섭하다 쎄다 어둡다 아깝다 낮다 밝다 가깝다 뜨겁다 얕다 좁다 덥다 깊다 밤늦다 멀다 춥다 적다 새롭다 귀엽다 낫다 아름답다 재미있다 멋지다 이쁘다 무겁다
서면미술관,1,무섭다 알차다 싫다 걸맞다 멋있다 시끄럽다 슬프다 급하다 인상깊다 가볍다 낯설다 외롭다 젊다 시뻘겋다 어렵다 아쉬우다 더럽다 맑다 붉다 비싸다 빠르다 쎄다 어둡다 아깝다 마땅찮다 따숩다 낮다 밝다 가깝다 빡세다 희다 뜨겁다 좁다 덥다 동그랗다 깊다 야무지다 수많다 멀다 춥다 적다 새롭다 엄청나다 귀엽다 아름답다 찹다 어두우다 재미있다 멋없다 색다르다 서툴다 이쁘다 즐겁다
AREA6,1,싸다 무섭다 지겹다 알차다 싫다 걸맞다 귀여우다 멋있다 추우다 놀랍다 곱다 촌스럽다 무겁다 급하다 재미나다 가볍다 낯설다 엄청나다 사이좋다 젊다 어렵다 맑다 비싸다 매섭다 남부럽다 빠르다 뿌옇다 어둡다 낮다 이쁘다 기막히다 가깝다 좁다 덥다 손색없다 밤늦다 깊다 야무지다 반갑다 알맞다 춥다 까맣다 적다 새롭다 두껍다 귀엽다 낫다 아름답다 어설프다 고르다 낡다 새까맣다 재미있다 안타깝다 멋지다 뜨겁다 즐겁다
창비부산,1,싸다 기쁘다 습하다 알차다 싫다 멋있다 두렵다 놀랍다 사납다 슬프다 멋들어지다 가볍다 낯설다 쨍하다 싱그럽다 하얗다 젊다 오래다 어렵다 느리다 가까우다 맑다 붉다 드물다 비싸다 힘드다 빠르다 어둡다 아깝다 낮다 밝다 가깝다 좁다 덥다 깊다 잽싸다 야무지다 반갑다 멀다 춥다 알맞다 적다 새롭다 귀엽다 낫다 아름답다 고르다 낡다 재미있다 멋지다 이쁘다 즐겁다 정신없다
박태준기념관,1,싸다 익다 무섭다 알차다 싫다 멋있다 정답다 슬프다 급하다 가볍다 예뿌다 하얗다 젊다 어렵다 아쉬우다 더럽다 차다 짙다 맑다 붉다 비싸다 힘드다 빠르다 귀하다 밝다 변함없다 남다르다 뜨겁다 좁다 덥다 깊다 야물딱지다 야무지다 반갑다 멀다 춥다 적다 새롭다 엄청나다 아름답다 낫다 낡다 재미있다 귀엽다 멋지다 이쁘다 색다르다 재미없다 즐겁다
브릭캠퍼스 부산,1,습하다 무섭다 알차다 싫다 멋있다 놀랍다 무겁다 급하다 인상깊다 재미나다 가볍다 엄청나다 어렵다 차다 가까우다 가쁘다 경이롭다 맑다 비싸다 빠르다 아깝다 어려우다 가깝다 빡세다 그립다 힘차다 덥다 깊다 야무지다 아름다우다 수많다 멀다 춥다 알맞다 적다 새롭다 귀엽다 낫다 아름답다 더우다 조그맣다 재미있다 색다르다 멋지다 이쁘다 즐겁다
센텀시티 아이스링크,1,흔하다 싸다 알차다 싫다 멋있다 놀랍다 급하다 가볍다 활기차다 엄청나다 못지않다 실하다 어렵다 느리다 짙다 맑다 차갑다 비싸다 힘드다 빠르다 아깝다 어려우다 밝다 가깝다 잽싸다 덥다 깊다 야무지다 멀다 춥다 알맞다 적다 두껍다 귀엽다 낫다 찹다 아름답다 고르다 안타깝다 조그맣다 재미있다 멋지다 뜨겁다 재미없다 즐겁다
태종대일대,1,싸다 무섭다 눈부시다 지겹다 알차다 싫다 오래다 멋있다 놀랍다 무겁다 슬프다 급하다 드넓다 힘드다 가볍다 엄청나다 젊다 못지않다 어렵다 징그럽다 드럽다 붉다 맑다 드물다 푸르다 비싸다 가까우다 짙다 빠르다 오지다 폭넓다 해맑다 쎄다 커다랗다 어둡다 간드러지다 낮다 이쁘다 밝다 기막히다 가깝다 그립다 좁다 덥다 동그랗다 빨갛다 환하다 야무지다 반갑다 지겨우다 약하다 새파랗다 수많다 정겹다 멀다 춥다 가파르다 적다 손쉽다 새롭다 귀엽다 아름답다 안타깝다 더우다 고르다 재미있다 멋지다 뜨겁다 무덥다 즐겁다
수영만 요트경기장,1,싸다 예뻤다 뜻있다 무섭다 알차다 추우다 오래다 멋있다 놀랍다 급하다 드넓다 가볍다 예뿌다 젊다 못지않다 어렵다 아쉬우다 해맑다 맑다 붉다 비싸다 빡시다 차갑다 묘하다 빠르다 세차다 쎄다 어둡다 끄떡없다 낮다 밝다 파랗다 가깝다 단촐하다 뜨겁다 덥다 깊다 환하다 수많다 멀다 춥다 알맞다 적다 새롭다 두껍다 귀엽다 아름답다 안타깝다 고르다 낡다 뜻깊다 재미있다 색다르다 멋지다 이쁘다 즐겁다 넓디넓다
부산 아시아드주경기장,1,싸다 끊임없다 무섭다 쩔다 알차다 싫다 멋있다 놀랍다 곱다 점잖다 급하다 드넓다 가볍다 낯설다 엄청나다 젊다 어렵다 차다 드럽다 맑다 힘드다 비싸다 가까우다 빠르다 섭하다 번거롭다 밝다 심심찮다 가깝다 빡세다 뜨겁다 좁다 덥다 깊다 빨갛다 부끄럽다 야무지다 반갑다 약하다 수많다 멀다 춥다 뼈저리다 적다 짠하다 귀엽다 낫다 안타깝다 고르다 순하다 재미있다 어이없다 멋지다 이쁘다 즐겁다 정신없다
문탠로드,1,싸다 무섭다 눈부시다 알차다 싫다 멋있다 급하다 노랗다 재미나다 앙증맞다 젊다 험하다 어렵다 아쉬우다 느리다 푸르다 맑다 붉다 비싸다 빠르다 쎄다 아깝다 낮다 어려우다 심심찮다 밝다 가깝다 뜨겁다 좁다 덥다 깊다 반갑다 가파르다 수많다 멀다 춥다 적다 새롭다 엄청나다 귀엽다 아름답다 흉하다 재미있다 색다르다 멋지다 이쁘다 무덥다 즐겁다
송도 구름산책로(스카이워크),1,무섭다 쩔다 알차다 싫다 걸맞다 멋있다 시끄럽다 드넓다 가볍다 외롭다 엄청나다 젊다 실하다 어렵다 아쉬우다 느리다 우렁차다 맑다 차갑다 드물다 비싸다 빠르다 쎄다 아깝다 낮다 밝다 가깝다 거칠다 얕다 좁다 덥다 손색없다 깊다 반갑다 수많다 멀다 춥다 적다 새롭다 흔하다 귀엽다 아름답다 안타깝다 더우다 재미있다 멋지다 이쁘다 푸르르다 즐겁다
해파랑길 2코스,1,싸다 무섭다 눈부시다 알차다 흐드러지다 싫다 멋있다 무겁다 급하다 노랗다 드넓다 가볍다 엄청나다 휑하다 하얗다 달갑다 젊다 어렵다 느리다 경이롭다 짙다 붉다 맑다 푸르다 비싸다 매섭다 묘하다 빡시다 빠르다 차갑다 세차다 드세다 거세다 낮다 이쁘다 변함없다 밝다 빡세다 거칠다 가깝다 남다르다 징그럽다 힘차다 좁다 얕다 빨갛다 덥다 깊다 반갑다 환하다 수많다 멀다 훤하다 춥다 적다 새롭다 곧다 귀엽다 낫다 아름답다 더우다 두껍다 재미있다 멋지다 뜨겁다 재미없다 즐겁다
해파랑길 1코스,1,싸다 무섭다 눈부시다 알차다 흐드러지다 생뚱맞다 싫다 멋있다 무겁다 급하다 드넓다 가볍다 엄청나다 휑하다 하얗다 젊다 어렵다 아쉬우다 느리다 차다 경이롭다 짙다 붉다 맑다 푸르다 비싸다 매섭다 묘하다 빡시다 빠르다 차갑다 달갑다 세차다 거세다 낮다 밝다 변함없다 가깝다 빡세다 거칠다 남다르다 징그럽다 힘차다 덥다 좁다 빨갛다 얕다 깊다 반갑다 환하다 수많다 멀다 훤하다 춥다 적다 새롭다 곧다 귀엽다 낫다 아름답다 더우다 두껍다 안타깝다 재미있다 멋지다 이쁘다 재미없다 즐겁다
스카이라인 루지(부산),1,싸다 무섭다 쩔다 알차다 싫다 멋있다 시끄럽다 촌스럽다 급하다 재미나다 가볍다 활기차다 낯설다 사이좋다 젊다 못지않다 어렵다 차다 따갑다 해맑다 푸르다 맑다 오지다 빠르다 귀하다 섭하다 시리다 번거롭다 낮다 파랗다 가깝다 거칠다 좁다 덥다 야무지다 아름다우다 약하다 가파르다 멀다 춥다 적다 엄청나다 귀엽다 아름답다 고르다 재미있다 쓸데없다 멋지다 이쁘다 서툴다 재미없다 즐겁다 정신없다
제이스글램핑,1,싸다 무섭다 알차다 싫다 귀여우다 시끄럽다 급하다 가볍다 예뿌다 외지다 외롭다 어렵다 느리다 더럽다 맑다 비싸다 빠르다 아깝다 번거롭다 밝다 낮다 가깝다 뜨거우다 좁다 덥다 야무지다 수많다 멀다 춥다 적다 새롭다 곧다 귀엽다 낫다 찹다 고르다 엄청나다 이쁘다 정신없다
임랑카라반파크,1,싸다 무섭다 알차다 싫다 걸맞다 멋있다 두렵다 수줍다 급하다 드넓다 가볍다 예뿌다 엄청나다 보잘것없다 젊다 어렵다 아쉬우다 차다 가까우다 맑다 붉다 비싸다 차갑다 빠르다 과하다 귀하다 세차다 쎄다 낮다 밝다 가깝다 뜨겁다 얕다 좁다 덥다 깊다 가파르다 정겹다 수많다 멀다 춥다 적다 새롭다 두껍다 귀엽다 아름답다 더우다 고르다 재미있다 멋지다 이쁘다 무덥다 즐겁다
더무빙카라반,1,흔하다 비좁다 습하다 값지다 무섭다 시렵다 눈부시다 지겹다 알차다 싫다 귀여우다 멋있다 너그럽다 시끄럽다 두렵다 놀랍다 급하다 노랗다 가볍다 앙증맞다 외지다 쨍하다 엄청나다 젊다 어렵다 아쉬우다 맑다 붉다 놀라우다 빠르다 과하다 뿌옇다 어둡다 바르다 낮다 하찮다 밝다 가깝다 값싸다 좁다 덥다 깊다 빨갛다 환하다 야무지다 정겹다 멀다 춥다 적다 새롭다 수많다 귀엽다 낫다 찹다 아름답다 고르다 안타깝다 재미있다 어이없다 색다르다 멋지다 이쁘다 즐겁다
서프마린,1,싸다 무섭다 알차다 싫다 걸맞다 멋있다 시끄럽다 놀랍다 급하다 드넓다 가볍다 낯설다 못지않다 어렵다 아쉬우다 푸르다 맑다 붉다 비싸다 빠르다 폭넓다 뿌옇다 쎄다 낮다 밝다 빡세다 거칠다 얕다 힘차다 덥다 좁다 동그랗다 야무지다 깊다 과하다 약하다 수많다 멀다 춥다 적다 손쉽다 새롭다 귀엽다 낫다 아름답다 뜻깊다 어이없다 재미있다 멋지다 이쁘다 색다르다 서툴다 재미없다 즐겁다
송정서핑학교,1,싸다 무섭다 알차다 싫다 멋있다 무겁다 급하다 재미나다 가볍다 싱그럽다 젊다 어렵다 짙다 맑다 힘드다 비싸다 빡시다 버겁다 빠르다 쎄다 밝다 거칠다 얕다 덥다 깊다 잽싸다 족하다 즐거우다 반갑다 약하다 멀다 춥다 알맞다 적다 두껍다 엄청나다 아름답다 고르다 낡다 재미있다 귀엽다 멋지다 이쁘다 즐겁다
다이아몬드베이,1,싸다 습하다 재빠르다 무섭다 지겹다 알차다 싫다 걸맞다 멋있다 놀랍다 거침없다 수줍다 무겁다 급하다 드넓다 가볍다 활기차다 휑하다 힘겹다 어렵다 아쉬우다 느리다 징그럽다 맑다 드물다 비싸다 빠르다 쎄다 어둡다 슬푸다 번거롭다 이쁘다 어려우다 하찮다 밝다 낮다 빡세다 가깝다 힘차다 덥다 좁다 얕다 깊다 야무지다 부끄럽다 수많다 멀다 춥다 적다 매끄럽다 새롭다 엄청나다 귀엽다 아름답다 더우다 고르다 재미있다 어이없다 색다르다 멋지다 뜨겁다 즐겁다
송도해안볼레길,1,싸다 무섭다 알차다 싫다 멋있다 시끄럽다 놀랍다 급하다 드넓다 가볍다 낯설다 엄청나다 싱그럽다 하얗다 젊다 실하다 못지않다 밉다 어렵다 아쉬우다 더럽다 푸르다 맑다 붉다 비싸다 빠르다 뿌옇다 세차다 어둡다 따숩다 낮다 이쁘다 하찮다 밝다 파랗다 감명깊다 희다 가깝다 남다르다 좁다 덥다 얕다 깊다 잽싸다 야무지다 반갑다 환하다 부끄럽다 가파르다 수많다 멀다 춥다 적다 매끄럽다 새롭다 귀엽다 아름답다 안타깝다 재미있다 멋지다 뜨겁다 즐겁다 정신없다
미포철길,1,예뻤다 얄궂다 무섭다 눈부시다 알차다 싫다 귀여우다 멋있다 무겁다 주옥같다 급하다 멋들어지다 드넓다 재미나다 가볍다 예뿌다 젊다 밉다 어렵다 아쉬우다 느리다 더럽다 차다 짙다 맑다 붉다 비싸다 차갑다 힘드다 빠르다 박하다 아깝다 거세다 낮다 이쁘다 밝다 가깝다 빡세다 얕다 좁다 덥다 손색없다 깊다 야무지다 반갑다 잽싸다 환하다 정겹다 멀다 춥다 적다 새롭다 엄청나다 아름답다 뛰어나다 더우다 고르다 재미있다 귀엽다 멋지다 뜨겁다 색다르다 즐겁다 정신없다
부산요트투어 3355마린,1,무섭다 눈부시다 지겹다 알차다 싫다 귀여우다 멋있다 미끄럽다 시끄럽다 수줍다 급하다 드넓다 가볍다 예뿌다 활기차다 엄청나다 젊다 어렵다 아쉬우다 차다 짙다 맑다 붉다 비싸다 묘하다 빠르다 쎄다 어둡다 아깝다 따숩다 낮다 이쁘다 어려우다 밝다 가깝다 힘차다 덥다 좁다 야무지다 반갑다 수많다 멀다 춥다 적다 새롭다 두껍다 귀엽다 아름답다 뛰어나다 안타깝다 높디높다 재미있다 색다르다 멋지다 뜨겁다 후하다 즐겁다 정신없다
요트탈래,1,흔하다 싸다 기쁘다 습하다 무섭다 틀림없다 알차다 싫다 미끄럽다 오래다 멋있다 냅다 놀랍다 곱다 급하다 인상깊다 드넓다 하얗다 젊다 어렵다 아쉬우다 경이롭다 맑다 붉다 비싸다 힘드다 오지다 묘하다 빠르다 쎄다 어둡다 드세다 거세다 번거롭다 이쁘다 밝다 낮다 파랗다 가깝다 남다르다 좁다 덥다 야무지다 반갑다 멀다 춥다 적다 새롭다 수많다 귀엽다 아름답다 뛰어나다 더우다 순하다 엄청나다 재미있다 멋지다 뜨겁다 즐겁다
부산아쿠아리움,1,싸다 끊임없다 습하다 무섭다 눈부시다 알차다 싫다 멋있다 시끄럽다 놀랍다 무겁다 급하다 인상깊다 낯익다 드넓다 가볍다 활기차다 앙증맞다 낯설다 하얗다 못지않다 힘겹다 어렵다 맑다 붉다 비싸다 빠르다 쎄다 어둡다 아깝다 드높다 낮다 이쁘다 하찮다 밝다 파랗다 가깝다 좁다 덥다 깊다 빨갛다 야무지다 반갑다 수많다 멀다 춥다 적다 짠하다 새롭다 귀엽다 낫다 아름답다 두껍다 고르다 뛰어나다 엄청나다 재미있다 어이없다 멋지다 뜨겁다 무덥다 즐겁다 정신없다
광안리패들보드,1,싸다 습하다 무섭다 알차다 싫다 미끄럽다 멋있다 추우다 무겁다 급하다 즐겁다 가볍다 예뿌다 낯설다 엄청나다 하얗다 힘겹다 어렵다 더럽다 차다 가까우다 후하다 푸르다 맑다 붉다 빡시다 차갑다 지겨우다 힘드다 빠르다 뿌옇다 쎄다 아깝다 바르다 파랗다 어려우다 밝다 가깝다 빡세다 얕다 힘차다 덥다 좁다 깊다 야무지다 약하다 멀다 춥다 알맞다 적다 새롭다 아름답다 고르다 순하다 재미있다 멋없다 귀엽다 어이없다 이쁘다 멋지다 색다르다 더러우다 어지럽다 정신없다
부산어묵체험관(삼진어묵),1,알차다 싫다 걸맞다 멋있다 촌스럽다 무겁다 문제없다 낯설다 엄청나다 젊다 어렵다 아쉬우다 맑다 붉다 비싸다 힘드다 빠르다 쎄다 어둡다 파랗다 가깝다 값싸다 좁다 깊다 야무지다 수많다 멀다 적다 새롭다 귀엽다 속상하다 찹다 고르다 안타깝다 뜻깊다 재미있다 즐겁다 정신없다
부산아이스링크,1,싸다 예뻤다 습하다 무섭다 알차다 싫다 추우다 멋있다 시끄럽다 두렵다 놀랍다 급하다 즐겁다 드넓다 가볍다 예뿌다 하얗다 젊다 못지않다 부시다 어렵다 아쉬우다 느리다 차다 짙다 맑다 차갑다 비싸다 빠르다 귀하다 섭하다 아깝다 낮다 밝다 가깝다 캄캄하다 희다 좁다 덥다 깊다 야무지다 반갑다 수많다 멀다 춥다 적다 매끄럽다 새롭다 엄청나다 귀엽다 속상하다 찹다 낫다 아름답다 낡다 재미있다 멋지다 이쁘다 재미없다 무덥다 어지럽다
달맞이갤러리도슨트투어,1,싸다 예뻤다 비좁다 습하다 틀림없다 알차다 싫다 멋있다 인상깊다 뻔하다 외롭다 엄청나다 사이좋다 젊다 느리다 가까우다 짙다 푸르다 맑다 붉다 비싸다 차갑다 쎄다 어둡다 낮다 밝다 감명깊다 거칠다 뜨겁다 잽싸다 덥다 깊다 부끄럽다 야무지다 멀다 춥다 적다 새롭다 수많다 귀엽다 흔하다 아름답다 더우다 어두우다 흥겹다 재미있다 멋지다 이쁘다 즐겁다
동래온천(허심청),1,기쁘다 무섭다 싫다 멋있다 무겁다 슬프다 급하다 드넓다 가볍다 예뿌다 엄청나다 젊다 어렵다 아쉬우다 가까우다 짙다 맑다 차갑다 비싸다 빠르다 섭하다 어둡다 낮다 밝다 가깝다 뜨겁다 좁다 덥다 손색없다 깊다 환하다 반갑다 약하다 수많다 멀다 알맞다 적다 매끄럽다 새롭다 귀엽다 낫다 용하다 고르다 순하다 낡다 재미있다 색다르다 멋지다 이쁘다 즐겁다 정신없다
베리굿농장체험,1,틀림없다 알차다 싫다 하얗다 못지않다 해맑다 드물다 가깝다 반갑다 춥다 적다 안타깝다 고르다 재미있다 뜨겁다 즐겁다 지겹다 추우다 실하다 어렵다 따시다 붉다 힘드다 낮다 하찮다 그럴싸하다 좁다 새롭다 특별나다 아름답다 귀엽다 차갑다 재미없다 습하다 무섭다 멋있다 두렵다 촌스럽다 무겁다 급하다 활기차다 엄청나다 더럽다 짙다 묘하다 빠르다 세차다 뿌옇다 어둡다 아깝다 어려우다 덥다 빨갛다 야무지다 정겹다 이쁘다 푸르르다 싸다 냅다 가볍다 젊다 맑다 푸르다 비싸다 쎄다 슬푸다 밝다 동그랗다 깊다 수많다 알맞다 까맣다 멀다 손쉽다 두껍다 낡다 어이없다 멋지다
부산바다축제,1,싸다 무섭다 알차다 싫다 귀여우다 멋있다 무겁다 급하다 드넓다 가볍다 엄청나다 외롭다 사이좋다 하얗다 젊다 어렵다 가까우다 맑다 붉다 비싸다 차갑다 힘드다 빠르다 드높다 이쁘다 가깝다 빡세다 좁다 덥다 깊다 족하다 야무지다 멀다 춥다 알맞다 새롭다 수많다 귀엽다 낫다 아름답다 더우다 흥겹다 낡다 재미있다 색다르다 멋지다 뜨겁다 재미없다 즐겁다 정신없다
수국축제,1,습하다 무섭다 알차다 흐드러지다 싫다 걸맞다 멋있다 시끄럽다 곱다 급하다 가볍다 예뿌다 엄청나다 싱그럽다 하얗다 젊다 못지않다 험하다 어렵다 차다 짙다 푸르다 맑다 붉다 드물다 비싸다 힘드다 빠르다 귀하다 뿌옇다 밝다 뜨겁다 얕다 힘차다 덥다 손색없다 깊다 가파르다 수많다 멀다 적다 손쉽다 새롭다 귀엽다 아름답다 안타깝다 더우다 재미있다 어이없다 멋지다 이쁘다 정신없다
부산불꽃축제,1,기쁘다 무섭다 틀림없다 알차다 싫다 걸맞다 고되다 멋있다 급하다 가볍다 엄청나다 젊다 못지않다 어렵다 벅차다 차다 가까우다 푸르다 맑다 비싸다 차갑다 힘드다 빠르다 쎄다 낮다 어려우다 밝다 가깝다 좁다 야무지다 반갑다 수많다 멀다 춥다 적다 안타깝다 새롭다 아름답다 낫다 뜻깊다 재미있다 멋지다 이쁘다 즐겁다 정신없다
