keyword,cluster,same
부산진성공원,2,싸다 무섭다 알차다 싫다 귀여우다 멋있다 놀랍다 거침없다 슬프다 급하다 가볍다 쨍하다 엄청나다 젊다 어렵다 느리다 맑다 붉다 드물다 비싸다 오지다 가까우다 빠르다 귀하다 과하다 쎄다 아깝다 시리다 단촐하다 밝다 가깝다 희다 좁다 덥다 깊다 빨갛다 야무지다 정겹다 수많다 멀다 춥다 적다 새롭다 곧다 귀엽다 아름답다 뛰어나다 안타깝다 뜻깊다 재미있다 이쁘다 재미없다 즐겁다 정신없다
금강공원,2,싸다 재빠르다 무섭다 알차다 싫다 걸맞다 멋있다 슬프다 급하다 낯익다 단촐하다 가볍다 엄청나다 못지않다 힘겹다 어렵다 느리다 더럽다 맑다 붉다 드물다 힘드다 빠르다 쎄다 커다랗다 낮다 밝다 가깝다 뜨겁다 좁다 깊다 잽싸다 야무지다 가파르다 수많다 멀다 춥다 적다 까다롭다 귀엽다 아름답다 낡다 뜻깊다 재미있다 색다르다 이쁘다 즐겁다
선암사(부산),2,싸다 무섭다 틀림없다 눈부시다 알차다 생뚱맞다 싫다 멋있다 곱다 슬프다 급하다 가볍다 앙증맞다 하얗다 젊다 못지않다 기똥차다 어렵다 차다 가까우다 따갑다 짙다 맑다 붉다 비싸다 징그럽다 묘하다 빠르다 귀하다 어둡다 간드러지다 거세다 낮다 이쁘다 밝다 빡세다 좁다 지리다 덥다 빨갛다 깊다 야무지다 환하다 가파르다 수많다 멀다 춥다 알맞다 적다 새롭다 억세다 귀엽다 아름답다 두껍다 낡다 재미있다 어이없다 멋지다 흔하다 즐겁다 주의깊다
동백공원,2,싸다 목마르다 습하다 무섭다 알차다 멋있다 시끄럽다 곱다 수줍다 급하다 가볍다 예뿌다 젊다 어렵다 푸르다 맑다 비싸다 묘하다 빠르다 밝다 가깝다 좁다 덥다 깊다 멀다 춥다 적다 새롭다 엄청나다 아름답다 찹다 더우다 낡다 조그맣다 귀엽다 멋지다 이쁘다
부산 올림픽동산,2,싸다 무섭다 싫다 걸맞다 멋있다 시끄럽다 사납다 무겁다 급하다 낯익다 노랗다 드넓다 가볍다 외롭다 젊다 어렵다 아쉬우다 따갑다 맑다 붉다 드물다 비싸다 묘하다 덩그러다 빠르다 섭하다 쎄다 어둡다 낮다 하찮다 밝다 가깝다 얕다 깊다 빨갛다 감쪽같다 야무지다 정겹다 멀다 춥다 뼈저리다 적다 손쉽다 새롭다 아름답다 낫다 뛰어나다 안타깝다 재미있다 어이없다 귀엽다 멋지다 색다르다 서툴다 즐겁다
삼락생태공원,2,알차다 흐드러지다 싫다 멋있다 드넓다 가볍다 낯설다 젊다 더럽다 짙다 맑다 붉다 빠르다 박하다 뿌옇다 낮다 밝다 파랗다 뜨겁다 힘차다 덥다 좁다 야무지다 반갑다 수많다 멀다 춥다 알맞다 귀엽다 낫다 아름답다 재미있다 멋지다 이쁘다 정신없다
부산 가톨릭 특성화 거리,2,싸다 기쁘다 습하다 얄궂다 뜻있다 쩔다 지겹다 알차다 싫다 걸맞다 귀여우다 멋있다 두렵다 곱다 이롭다 무겁다 인상깊다 즐겁다 드넓다 가볍다 낯설다 외롭다 하얗다 젊다 어렵다 아쉬우다 느리다 해맑다 맑다 푸르다 드물다 비싸다 빠르다 폭넓다 과하다 어둡다 아깝다 낮다 어려우다 심심찮다 밝다 가깝다 그립다 거칠다 희다 좁다 깊다 부끄럽다 야무지다 수많다 멀다 춥다 줄기차다 유례없다 적다 새롭다 엄청나다 귀엽다 아름답다 뛰어나다 고르다 즐거다 조그맣다 재미있다 멋지다 우렁차다 어지럽다
김민부전망대,2,무섭다 알차다 싫다 멋있다 무겁다 가볍다 예뿌다 젊다 힘겹다 어렵다 아쉬우다 느리다 징그럽다 해맑다 맑다 붉다 드물다 빠르다 낮다 밝다 빡세다 얕다 좁다 깊다 가파르다 정겹다 수많다 멀다 새롭다 귀엽다 아름답다 뛰어나다 안타깝다 낡다 재미있다 어이없다 멋지다 이쁘다 즐겁다
부산영화촬영스튜디오,2,싸다 무섭다 알차다 싫다 걸맞다 멋있다 놀랍다 급하다 인상깊다 노랗다 가볍다 예뿌다 엄청나다 싱그럽다 힘겹다 어렵다 차다 가까우다 맑다 붉다 빠르다 귀하다 과하다 밝다 얕다 깊다 반갑다 수많다 멀다 적다 매끄럽다 새롭다 귀엽다 아름답다 찹다 어설프다 뜻깊다 멋없다 재미있다 멋지다 이쁘다 어지럽다
화명생태공원,2,비좁다 싸다 끊임없다 무섭다 흐드러지다 생뚱맞다 싫다 오래다 멋있다 시끄럽다 놀랍다 가볍다 예뿌다 활기차다 쨍하다 휑하다 젊다 어렵다 아쉬우다 징그럽다 해맑다 푸르다 맑다 붉다 빠르다 과하다 뿌옇다 어둡다 시리다 낮다 밝다 가깝다 우중충하다 좁다 덥다 깊다 환하다 야무지다 반갑다 멀다 춥다 적다 까다롭다 새롭다 손쉽다 아름답다 엄청나다 고르다 감질나다 재미있다 귀엽다 멋지다 이쁘다 재미없다 즐겁다 정신없다
가덕도 외양포,2,그리우다 흔하다 싸다 기쁘다 무섭다 눈부시다 알차다 흐드러지다 싫다 미끄럽다 멋있다 슬프다 드넓다 가볍다 젊다 못지않다 힘겹다 어렵다 아쉬우다 따갑다 짙다 푸르다 맑다 붉다 해맑다 빠르다 귀하다 거세다 낮다 밝다 가깝다 희다 힘차다 덥다 좁다 깊다 반갑다 정겹다 멀다 춥다 까맣다 적다 새롭다 귀엽다 아름답다 안타깝다 낡다 조그맣다 재미있다 멋지다 이쁘다 즐겁다
장림포구,2,싸다 기쁘다 습하다 무섭다 알차다 싫다 걸맞다 멋있다 낯익다 노랗다 드넓다 가볍다 예뿌다 쨍하다 엄청나다 휑하다 하얗다 젊다 어렵다 아쉬우다 느리다 차다 쑥스럽다 붉다 맑다 드물다 차갑다 힘드다 묘하다 덩그러다 빠르다 뿌옇다 세차다 어둡다 시리다 드세다 낮다 이쁘다 밝다 가깝다 그립다 좁다 덥다 얕다 빨갛다 야무지다 반갑다 아름다우다 약하다 수많다 멀다 까맣다 춥다 적다 새롭다 귀엽다 아름답다 찹다 더우다 안타깝다 조그맣다 재미있다 멋지다 흔하다 어지럽다
낙동강하구,2,끊임없다 무섭다 알차다 싫다 귀여우다 멋있다 미끄럽다 놀랍다 구리다 노랗다 드넓다 가볍다 엄청나다 싱그럽다 젊다 못지않다 어렵다 벅차다 느리다 벌겋다 짙다 맑다 붉다 드물다 비싸다 빠르다 폭넓다 세차다 어둡다 서럽다 낮다 어려우다 빡세다 거칠다 힘차다 덥다 좁다 깊다 환하다 약하다 정겹다 수많다 멀다 춥다 알맞다 적다 새롭다 아름답다 안타깝다 재미있다 멋지다 이쁘다 즐겁다
두도,2,싸다 습하다 재빠르다 무섭다 눈부시다 싫다 걸맞다 멋있다 시끄럽다 드넓다 가볍다 낯설다 엄청나다 하얗다 젊다 못지않다 어렵다 푸르다 맑다 붉다 비싸다 힘드다 빠르다 뿌옇다 세차다 쎄다 어둡다 아깝다 낮다 밝다 파랗다 가깝다 감명깊다 희다 힘차다 덥다 좁다 얕다 족하다 야무지다 반갑다 살갑다 환하다 즐거우다 수많다 멀다 춥다 가파르다 적다 새롭다 귀엽다 아름답다 안타깝다 어설프다 격하다 낡다 재미있다 어이없다 멋지다 이쁘다 볼품없다 어지럽다
몰운대,2,기쁘다 습하다 틀림없다 싫다 추우다 멋있다 정답다 시끄럽다 촌스럽다 드넓다 가볍다 외지다 하얗다 젊다 힘겹다 어렵다 아쉬우다 느리다 맑다 붉다 비싸다 차갑다 오지다 묘하다 빠르다 뿌옇다 세차다 쎄다 거세다 낮다 어려우다 밝다 가깝다 얕다 좁다 덥다 동그랗다 깊다 야무지다 반갑다 부끄럽다 멀다 춥다 적다 새롭다 엄청나다 아름답다 낫다 낡다 재미있다 귀엽다 멋지다 이쁘다 즐겁다 주의깊다 넓디넓다
백양산,2,싸다 눈부시다 알차다 싫다 고되다 멋있다 곱다 이롭다 짙붉다 무겁다 급하다 인상깊다 즐겁다 노랗다 가볍다 싱그럽다 하얗다 젊다 못지않다 험하다 어렵다 가까우다 벌겋다 따갑다 짙다 맑다 붉다 푸르다 비싸다 빠르다 과하다 어둡다 시리다 낮다 이쁘다 밝다 파랗다 빡세다 그립다 희다 가깝다 좁다 덥다 깊다 빨갛다 가파르다 수많다 멀다 춥다 적다 손쉽다 새롭다 귀엽다 속상하다 아름답다 순하다 낡다 재미있다 어이없다 쓸데없다 멋지다 뜨겁다 어지럽다 주의깊다
역사의 디오라마,2,고달프다 무섭다 지겹다 알차다 싫다 멋있다 급하다 드넓다 가볍다 앙증맞다 낯설다 외롭다 엄청나다 못지않다 힘겹다 어렵다 느리다 쑥스럽다 짙다 맑다 차갑다 비싸다 힘드다 빠르다 폭넓다 섭하다 과하다 어둡다 아깝다 옛스럽다 낮다 하찮다 심심찮다 밝다 가깝다 뜨겁다 좁다 덥다 깊다 반갑다 아름다우다 정겹다 수많다 멀다 춥다 알맞다 적다 새롭다 흔하다 귀엽다 아름답다 안타깝다 고르다 낡다 재미있다 색다르다 멋지다 이쁘다 즐겁다
승학산,2,틀림없다 알차다 싫다 인상깊다 따갑다 가깝다 얕다 힘차다 반갑다 춥다 적다 안타깝다 고르다 재미있다 뜨겁다 즐겁다 기쁘다 지겹다 이롭다 노랗다 어렵다 가까우다 가쁘다 붉다 힘드다 낮다 좁다 가파르다 속상하다 아름답다 귀엽다 뜻깊다 색다르다 습하다 무섭다 미끄럽다 멋있다 무겁다 급하다 드넓다 재미나다 엄청나다 험하다 느리다 더럽다 젊다 짙다 그럴싸하다 빠르다 귀하다 뿌옇다 숨차다 어둡다 아깝다 덥다 빨갛다 야무지다 정겹다 흉하다 이쁘다 놀랍다 곱다 가볍다 힘겹다 맑다 비싸다 박하다 연하다 밝다 빡세다 그립다 깊다 약하다 멀다 손쉽다 낫다 뛰어나다 멋지다
땅뫼산,2,흔하다 무섭다 알차다 싫다 미끄럽다 멋있다 노랗다 드넓다 가볍다 앙증맞다 낯설다 외지다 하얗다 가파르다 젊다 못지않다 어렵다 따시다 가쁘다 푸르다 맑다 붉다 빡시다 차갑다 힘드다 빠르다 뿌옇다 어둡다 낮다 밝다 가깝다 빡세다 그립다 좁다 덥다 깊다 야무지다 반갑다 멀다 춥다 적다 곧다 귀엽다 아름답다 뛰어나다 고르다 재미있다 멋지다 이쁘다 즐겁다
죽성항(황학대),2,흔하다 싸다 눈부시다 지겹다 알차다 걸맞다 미끄럽다 오래다 멋있다 곱다 재미나다 가볍다 앙증맞다 하얗다 젊다 어렵다 벅차다 경이롭다 맑다 붉다 드물다 비싸다 묘하다 덩그러다 귀하다 낮다 가깝다 얕다 힘차다 덥다 좁다 깊다 반갑다 가파르다 정겹다 멀다 춥다 새롭다 아름답다 낫다 새까맣다 안타깝다 어여쁘다 멋지다 이쁘다 무덥다 즐겁다
천마산하늘전망대,2,싸다 비좁다 새카맣다 검붉다 무섭다 알차다 걸맞다 멋있다 놀랍다 이롭다 수줍다 급하다 즐겁다 드넓다 노랗다 가볍다 싱그럽다 젊다 못지않다 힘겹다 어렵다 험하다 비탈지다 짙다 붉다 맑다 비싸다 좁디좁다 힘드다 빠르다 뿌옇다 어둡다 아깝다 낮다 이쁘다 심심찮다 밝다 가깝다 거칠다 희다 좁다 얕다 손색없다 깊다 환하다 가파르다 수많다 멀다 춥다 적다 손쉽다 새롭다 억세다 귀엽다 아름답다 안타깝다 재미있다 색다르다 멋지다 흔하다 재미없다 어지럽다
천성항 방파제등대,2,싸다 습하다 싫다 오래다 멋있다 놀랍다 급하다 드넓다 가볍다 못지않다 어렵다 느리다 더럽다 차다 징그럽다 짙다 푸르다 맑다 붉다 차갑다 빠르다 귀하다 박하다 쎄다 밝다 변함없다 가깝다 얕다 힘차다 좁다 깊다 환하다 부끄럽다 반갑다 약하다 멀다 춥다 까맣다 적다 손쉽다 새롭다 수많다 흔하다 두껍다 용하다 엄청나다 재미있다 귀엽다 멋지다 이쁘다 즐겁다
은진사,2,무섭다 싫다 가볍다 싱그럽다 하얗다 젊다 짙다 맑다 붉다 과하다 뿌옇다 아깝다 서럽다 밝다 가깝다 그립다 희다 희망차다 힘차다 좁다 깊다 반갑다 수많다 까맣다 적다 엄청나다 귀엽다 아름답다 재미있다 멋지다 이쁘다 즐겁다
홍연폭포,2,값지다 무섭다 흐드러지다 싫다 미끄럽다 오래다 멋있다 두렵다 무겁다 두드러지다 엄청나다 하얗다 젊다 어렵다 우렁차다 쑥스럽다 해맑다 맑다 붉다 드물다 비싸다 빠르다 세차다 쎄다 아깝다 거세다 낮다 밝다 보드랍다 가깝다 그립다 거칠다 뜨겁다 힘차다 덥다 좁다 깊다 잽싸다 반갑다 가파르다 춥다 적다 아름답다 안타깝다 더우다 뜻깊다 감질나다 귀엽다 멋지다 이쁘다 재미있다 즐겁다
오륜대전망대,2,알차다 싫다 미끄럽다 멋있다 곱다 급하다 가볍다 낯설다 외롭다 젊다 험하다 어렵다 가쁘다 짙다 푸르다 맑다 붉다 매섭다 묘하다 빠르다 뿌옇다 낮다 하찮다 밝다 파랗다 가깝다 희다 좁다 덥다 깊다 야무지다 가파르다 수많다 멀다 춥다 적다 새롭다 아름답다 안타깝다 낡다 뜻깊다 멋지다 뜨겁다 우습다
안심치유정원,2,쩔다 싫다 추우다 시끄럽다 이롭다 노랗다 낯설다 쨍하다 싱그럽다 못지않다 어렵다 짙다 맑다 묘하다 빠르다 어둡다 낮다 이쁘다 밝다 파랗다 가깝다 희다 좁다 깊다 덥다 야무지다 반갑다 알맞다 춥다 손쉽다 두껍다 엄청나다 아름답다 어이없다 귀엽다 멋지다 차갑다 즐겁다
곰내연밭,2,흔하다 습하다 재빠르다 무섭다 싫다 미끄럽다 멋있다 놀랍다 곱다 짙푸르다 수줍다 드넓다 가볍다 앙증맞다 쨍하다 못지않다 어렵다 벅차다 징그럽다 푸르다 맑다 힘드다 빠르다 드높다 보드랍다 가깝다 우중충하다 뜨거우다 남다르다 얕다 좁다 덥다 깊다 반갑다 유별나다 약하다 새파랗다 정겹다 가파르다 훤하다 적다 두껍다 수많다 귀엽다 낫다 아름답다 더우다 순하다 어여쁘다 낡다 재미있다 엄청나다 색다르다 멋지다 이쁘다 즐겁다
관음사,2,싸다 알차다 싫다 고되다 멋있다 놀랍다 곱다 무겁다 가볍다 엄청나다 못지않다 힘겹다 어렵다 짙다 푸르다 맑다 붉다 드물다 비싸다 빠르다 박하다 쎄다 어둡다 슬푸다 낮다 하찮다 밝다 가깝다 빡세다 좁다 덥다 깊다 야무지다 가파르다 멀다 춥다 적다 새롭다 아름답다 낫다 안타깝다 어이없다 귀엽다 멋지다 이쁘다 즐겁다
용호별빛공원,2,끊임없다 무섭다 눈부시다 빼어나다 지겹다 흐드러지다 싫다 걸맞다 멋있다 놀랍다 곱다 무겁다 가볍다 엄청나다 하얗다 젊다 못지않다 힘겹다 부시다 어렵다 차다 가까우다 짙다 붉다 맑다 드물다 푸르다 버겁다 비싸다 힘드다 빠르다 뿌옇다 아깝다 이쁘다 밝다 가깝다 좁다 힘차다 덥다 손색없다 빨갛다 얕다 반갑다 깊다 약하다 정겹다 수많다 멀다 적다 매끄럽다 새롭다 귀엽다 아름답다 뛰어나다 낡다 재미있다 색다르다 멋지다 뜨겁다 즐겁다
금정산,2,습하다 무섭다 쩔다 알차다 싫다 멋있다 무겁다 가볍다 엄청나다 하얗다 젊다 어렵다 차다 푸르다 맑다 붉다 빠르다 쎄다 낮다 어려우다 밝다 가깝다 거칠다 희망차다 남다르다 좁다 덥다 깊다 잽싸다 환하다 즐거우다 반갑다 가파르다 수많다 멀다 춥다 적다 새롭다 흔하다 귀엽다 곧다 아름답다 안타깝다 조그맣다 색다르다 멋지다 이쁘다 후하다 즐겁다
금강식물원,2,싸다 재빠르다 무섭다 알차다 싫다 오래다 멋있다 촌스럽다 낯설다 사이좋다 젊다 느리다 징그럽다 맑다 붉다 비싸다 묘하다 빠르다 어둡다 아깝다 낮다 가깝다 그립다 거칠다 얕다 좁다 덥다 동그랗다 깊다 야무지다 반갑다 잽싸다 친하다 멀다 춥다 뼈저리다 적다 까다롭다 곧다 수많다 귀엽다 아름답다 찹다 고르다 순하다 엄청나다 뜻깊다 색다르다 멋지다 이쁘다
수리조선소길,2,흔하다 비좁다 습하다 무섭다 틀림없다 눈부시다 빼어나다 알차다 걸맞다 멋있다 시끄럽다 곱다 급하다 즐겁다 가볍다 활기차다 낯설다 엄청나다 하얗다 젊다 못지않다 기똥차다 어렵다 아쉬우다 짙다 맑다 붉다 드물다 푸르다 비싸다 좁디좁다 빠르다 과하다 섭하다 세차다 아깝다 이쁘다 변함없다 밝다 가깝다 그립다 거칠다 남다르다 좁다 덥다 깊다 부끄럽다 야무지다 가파르다 정겹다 멀다 적다 새롭다 수많다 귀엽다 낫다 아름답다 안타깝다 굳세다 낡다 뜻깊다 재미있다 쓸데없다 멋지다 뜨겁다 어지럽다 넓디넓다
부산차량융합기술단(부산철도차량정비단),2,빠르다 씨다 엄청나다 적다 쎄다 새롭다 아름답다 걸맞다 고르다 어렵다 낮다 밝다 맑다 깊다 구리다 어지럽다
성지곡수원지,2,예뻤다 기쁘다 얄궂다 무섭다 눈부시다 싫다 귀여우다 멋있다 놀랍다 무겁다 슬프다 가볍다 예뿌다 휑하다 하얗다 젊다 어렵다 푸르다 맑다 붉다 드물다 차갑다 힘드다 빠르다 새하얗다 커다랗다 어둡다 낮다 밝다 가깝다 빡세다 얕다 덥다 밤늦다 깊다 야무지다 가파르다 멀다 춥다 까맣다 적다 새롭다 엄청나다 속상하다 아름답다 고르다 뜻깊다 재미있다 귀엽다 쓸데없다 이쁘다 멋지다 즐겁다 정신없다
가덕도 연대봉,2,싸다 무섭다 쩔다 눈부시다 알차다 싫다 멋있다 시끄럽다 놀랍다 수줍다 급하다 노랗다 가볍다 엄청나다 못지않다 어렵다 따갑다 경이롭다 푸르다 맑다 붉다 비싸다 차갑다 짙다 빠르다 귀하다 어둡다 낮다 밝다 가깝다 얕다 좁다 덥다 깊다 야무지다 반갑다 약하다 수많다 멀다 까맣다 춥다 알맞다 귀엽다 아름답다 안타깝다 재미있다 멋지다 이쁘다
누리바라기전망대,2,무섭다 알차다 멋있다 수줍다 급하다 즐겁다 가볍다 못지않다 힘겹다 어렵다 더럽다 젊다 맑다 붉다 비싸다 짙다 빠르다 귀하다 어둡다 아깝다 밝다 가깝다 거칠다 좁다 깊다 손색없다 아름다우다 새파랗다 멀다 춥다 적다 손쉽다 엄청나다 아름답다 재미있다 색다르다 멋지다 이쁘다 어지럽다
신호공원,2,싸다 습하다 무섭다 쩔다 눈부시다 싫다 멋있다 냅다 시끄럽다 놀랍다 이롭다 수줍다 급하다 드넓다 가볍다 젊다 험하다 어렵다 느리다 만만찮다 맑다 붉다 비싸다 힘드다 매섭다 그럴싸하다 빠르다 귀하다 박하다 어둡다 연하다 낮다 어려우다 밝다 파랗다 가깝다 희다 뜨겁다 얕다 좁다 덥다 깊다 부끄럽다 야무지다 가파르다 멀다 춥다 적다 새롭다 아름답다 낫다 찹다 더우다 어설프다 안타깝다 재미있다 어이없다 귀엽다 멋지다 이쁘다 색다르다 즐겁다
혜원정사,2,흔하다 싸다 기쁘다 끊임없다 재빠르다 무섭다 틀림없다 싫다 오래다 두렵다 놀랍다 이롭다 곱다 사납다 급하다 즐겁다 활기차다 하얗다 젊다 어렵다 느리다 푸르다 맑다 붉다 드물다 가까우다 빠르다 폭넓다 귀하다 바르다 번거롭다 어려우다 하찮다 밝다 낮다 거칠다 희다 가깝다 남다르다 힘차다 좁다 깊다 환하다 부끄럽다 야무지다 가파르다 정겹다 멀다 춥다 적다 매끄럽다 새롭다 수많다 아름답다 낫다 가엾다 어두우다 즐거다 두껍다 낡다 뛰어나다 안타깝다 어지럽다 우습다
추리문학관,2,싫다 낯설다 외롭다 달갑다 따갑다 해맑다 드물다 시리다 가깝다 감명깊다 얕다 살갑다 부끄럽다 반갑다 춥다 적다 가엾다 고르다 굳세다 조그맣다 재미있다 즐겁다 우습다 재빠르다 지겹다 뿌리깊다 오래다 서글프다 어렵다 차다 붉다 힘드다 오지다 낮다 하찮다 희다 좁다 잽싸다 새롭다 아름답다 귀엽다 차갑다 재미없다 무섭다 눈부시다 멋있다 무겁다 급하다 험하다 느리다 더럽다 짙다 빠르다 귀하다 세차다 어둡다 아깝다 덥다 정겹다 올곧다 쓸데없다 이쁘다 싸다 놀랍다 곱다 샛노랗다 슬프다 젊다 맑다 푸르다 밝다 그립다 깊다 족하다 수많다 알맞다 까맣다 멀다 짠하다 두껍다 낫다 찹다 낡다 멋지다
백산기념관,2,기쁘다 무섭다 빼어나다 알차다 싫다 걸맞다 오래다 멋있다 무겁다 급하다 인상깊다 드넓다 가볍다 엄청나다 젊다 힘겹다 어렵다 험하다 경이롭다 짙다 맑다 붉다 차갑다 오지다 가까우다 빠르다 박하다 쎄다 아깝다 연하다 낮다 이쁘다 밝다 가깝다 좁다 깊다 환하다 정겹다 수많다 멀다 훤하다 알맞다 적다 새롭다 흔하다 귀엽다 뛰어나다 안타깝다 고르다 낡다 뜻깊다 재미있다 멋지다 뜨겁다 무덥다 즐겁다
부산 강서문화원,2,흔하다 습하다 틀림없다 눈부시다 지겹다 알차다 흐드러지다 싫다 멋있다 이롭다 촌스럽다 급하다 드넓다 가볍다 앙증맞다 낯설다 엄청나다 씨다 젊다 어렵다 차다 맑다 힘드다 비싸다 가까우다 빠르다 과하다 어둡다 아깝다 낮다 밝다 파랗다 가깝다 좁다 덥다 깊다 반갑다 가파르다 멀다 춥다 알맞다 적다 매끄럽다 새롭다 수많다 귀엽다 낫다 아름답다 더우다 뛰어나다 안타깝다 재미있다 멋지다 이쁘다 즐겁다
부산해양자연사박물관,2,싸다 습하다 무섭다 알차다 싫다 오래다 멋있다 놀랍다 급하다 인상깊다 활기차다 낯설다 엄청나다 하얗다 못지않다 어렵다 느리다 징그럽다 맑다 붉다 드물다 비싸다 차갑다 빠르다 커다랗다 아깝다 어둡다 번거롭다 어려우다 가깝다 좁다 덥다 깊다 반갑다 수많다 멀다 적다 짠하다 새롭다 귀엽다 아름답다 안타깝다 재미있다 멋지다 이쁘다 재미없다 즐겁다 정신없다
수산과학관(부산),2,싸다 습하다 무섭다 알차다 싫다 걸맞다 멋있다 놀랍다 곱다 문제없다 급하다 즐겁다 노랗다 가볍다 낯설다 사이좋다 못지않다 밉다 어렵다 차다 우렁차다 징그럽다 푸르다 맑다 차갑다 빠르다 섭하다 쎄다 낮다 어려우다 가깝다 얕다 좁다 덥다 깊다 야무지다 춥다 적다 새롭다 엄청나다 귀엽다 낫다 아름답다 뜻깊다 재미있다 멋지다 이쁘다 재미없다 어지럽다
부산광역시립 부전도서관,2,싸다 알차다 싫다 멋있다 볼품없다 구리다 급하다 인상깊다 가볍다 두드러지다 사이좋다 하얗다 젊다 못지않다 어렵다 아쉬우다 만만찮다 맑다 붉다 비싸다 묘하다 빠르다 낮다 가깝다 빡세다 거칠다 좁다 깊다 반갑다 멀다 춥다 알맞다 적다 손쉽다 새롭다 수많다 귀엽다 두껍다 엄청나다 낡다 뜻깊다 재미있다 멋지다 이쁘다 재미없다 즐겁다 정신없다
부산광역시립 사하도서관,2,알차다 싫다 멋있다 급하다 가볍다 두드러지다 하얗다 어렵다 아쉬우다 맑다 붉다 비싸다 힘드다 묘하다 빠르다 낮다 밝다 가깝다 거칠다 동그랗다 힘차다 깊다 좁다 멀다 춥다 알맞다 적다 손쉽다 새롭다 두껍다 아름답다 엄청나다 싸다 재미있다 색다르다 멋지다 재미없다
부산점자도서관,2,흔하다 기쁘다 알차다 싫다 멋있다 놀랍다 급하다 인상깊다 가볍다 뜨시다 젊다 못지않다 어렵다 경이롭다 맑다 붉다 비싸다 빠르다 어둡다 낮다 가깝다 그립다 거칠다 좁다 덥다 깊다 친하다 야무지다 반갑다 멀다 춥다 적다 새롭다 수많다 귀엽다 낫다 아름답다 엄청나다 뜻깊다 재미있다 멋지다 이쁘다 즐겁다
임시수도기념관,2,싸다 끊임없다 알차다 싫다 슬프다 급하다 가볍다 젊다 험하다 어렵다 굳세다 맑다 붉다 힘드다 찡하다 빠르다 하찮다 좁다 덥다 손색없다 깊다 반갑다 정겹다 수많다 멀다 적다 새롭다 귀엽다 낫다 아름답다 고르다 낡다 조그맣다 뜻깊다 재미있다 멋지다 이쁘다 즐겁다
국립해양박물관,2,습하다 뜻있다 무섭다 지겹다 알차다 걸맞다 고되다 멋있다 놀랍다 급하다 낯익다 즐겁다 가볍다 엄청나다 어렵다 아쉬우다 징그럽다 짙다 맑다 비싸다 빠르다 어둡다 아깝다 파랗다 밝다 가깝다 뜨겁다 얕다 힘차다 덥다 좁다 깊다 야무지다 반갑다 멀다 춥다 적다 새롭다 아름답다 안타깝다 재미있다 귀엽다 멋지다 이쁘다 어지럽다 정신없다
누리마루 APEC하우스,2,숱하다 끊임없다 무섭다 알차다 멋있다 곱다 인상깊다 드넓다 가볍다 외롭다 젊다 못지않다 험하다 느리다 짙다 푸르다 맑다 붉다 차갑다 빠르다 어둡다 낮다 밝다 가깝다 빡세다 그립다 얕다 덥다 깊다 빨갛다 수많다 멀다 춥다 줄기차다 새롭다 귀엽다 아름답다 뛰어나다 더우다 뜻깊다 재미있다 색다르다 멋지다 이쁘다 재미없다 즐겁다
