keyword,cluster,same
킴스아트필드미술관,2,기쁘다 무섭다 지겹다 알차다 싫다 멋있다 놀랍다 무겁다 슬프다 가볍다 외롭다 하얗다 젊다 어렵다 느리다 가쁘다 징그럽다 짙다 푸르다 맑다 비싸다 붉다 빡시다 뿌옇다 어둡다 아깝다 시리다 낮다 밝다 가깝다 좁다 덥다 깊다 야무지다 수많다 멀다 새롭다 두껍다 귀엽다 아름답다 엄청나다 어여쁘다 재미있다 멋지다 이쁘다 즐겁다
요산문학관,2,무섭다 틀림없다 싫다 걸맞다 멋있다 놀랍다 샛노랗다 서글프다 급하다 노랗다 두드러지다 외롭다 젊다 어렵다 짙다 맑다 붉다 비싸다 드물다 빠르다 아깝다 낮다 밝다 파랗다 그립다 가깝다 주옥같다 깊다 부끄럽다 정겹다 수많다 멀다 올곧다 적다 새롭다 곧다 아름답다 흥겹다 뜻깊다 재미있다 이쁘다 즐겁다 우습다
한국기독교선교박물관,2,싸다 비좁다 기쁘다 끊임없다 값지다 뜻있다 무섭다 틀림없다 알차다 싫다 걸맞다 두렵다 놀랍다 곱다 슬프다 급하다 가볍다 앙증맞다 낯설다 젊다 험하다 어렵다 벅차다 더럽다 맑다 붉다 드물다 빠르다 귀하다 어둡다 아깝다 거세다 낮다 희다 남다르다 힘차다 좁다 깊다 반갑다 수많다 멀다 춥다 뼈저리다 적다 새롭다 곧다 아름답다 안타깝다 낡다 뜻깊다 멋지다 이쁘다 즐겁다
국립일제강제동원역사관,2,비좁다 습하다 무섭다 알차다 싫다 걸맞다 오래다 멋있다 슬프다 무겁다 재미나다 가볍다 낯설다 엄청나다 젊다 어렵다 짙다 좁디좁다 맑다 붉다 힘드다 빠르다 귀하다 어둡다 밝다 가깝다 희다 좁다 깊다 환하다 반갑다 적다 수많다 속상하다 뛰어나다 안타깝다 조그맣다 뜻깊다 재미있다 귀엽다 멋지다 재미없다 즐겁다
유엔평화기념관,2,싸다 기쁘다 눈부시다 알차다 싫다 멋있다 슬프다 급하다 가볍다 외롭다 엄청나다 젊다 못지않다 어렵다 해맑다 푸르다 맑다 붉다 좁디좁다 묘하다 빠르다 귀하다 아깝다 밝다 가깝다 얕다 좁다 덥다 깊다 환하다 부끄럽다 반갑다 수많다 멀다 춥다 적다 새롭다 귀엽다 아름답다 안타깝다 굳세다 뜻깊다 재미있다 멋지다 무덥다 정신없다
부산현대미술관,2,싸다 예뻤다 무섭다 눈부시다 알차다 싫다 오래다 멋있다 시끄럽다 무겁다 급하다 인상깊다 노랗다 가볍다 낯설다 엄청나다 젊다 어렵다 가까우다 해맑다 맑다 붉다 비싸다 차갑다 묘하다 빠르다 귀하다 커다랗다 아깝다 어둡다 낮다 밝다 변함없다 가깝다 거칠다 얕다 좁다 깊다 반갑다 정겹다 수많다 멀다 춥다 적다 새롭다 귀엽다 낫다 재미있다 색다르다 멋지다 이쁘다 재미없다 즐겁다
현대모터스튜디오 부산,2,비좁다 기쁘다 무섭다 틀림없다 알차다 걸맞다 귀여우다 멋있다 놀랍다 무겁다 급하다 인상깊다 낯익다 가볍다 낯설다 엄청나다 아낌없다 젊다 힘겹다 어렵다 만만찮다 차다 맑다 힘드다 비싸다 묘하다 빠르다 폭넓다 섭하다 쎄다 아깝다 낮다 어려우다 밝다 가깝다 그립다 얕다 좁다 덥다 깊다 야무지다 새파랗다 수많다 멀다 춥다 적다 까다롭다 새롭다 손쉽다 귀엽다 낫다 아름답다 보람차다 뛰어나다 안타깝다 조그맣다 뜻깊다 재미있다 멋지다 이쁘다 즐겁다
영도 조내기 고구마 역사기념관,2,무섭다 알차다 싫다 걸맞다 미끄럽다 시끄럽다 급하다 가볍다 젊다 어렵다 맑다 비싸다 빠르다 뿌옇다 낮다 어려우다 밝다 파랗다 좁다 덥다 깊다 밤늦다 가파르다 춥다 엄청나다 아름답다 뛰어나다 찹다 고르다 조그맣다 재미있다 어이없다 귀엽다 멋지다 이쁘다 즐겁다
부산근대역사관,2,싸다 무섭다 알차다 싫다 오래다 멋있다 정답다 곱다 수줍다 서글프다 인상깊다 낯익다 즐겁다 노랗다 가볍다 험하다 어렵다 맑다 붉다 드물다 비싸다 빠르다 과하다 쎄다 어둡다 어려우다 가깝다 희다 좁다 덥다 깊다 빨갛다 부끄럽다 야무지다 반갑다 수많다 멀다 춥다 짠하다 새롭다 귀엽다 아름답다 뛰어나다 안타깝다 낡다 재미있다 멋지다 이쁘다 어지럽다
용호동일대 바다낚시,2,기쁘다 습하다 끊임없다 무섭다 눈부시다 알차다 싫다 멋있다 시끄럽다 곱다 노랗다 드넓다 가볍다 낯설다 엄청나다 하얗다 젊다 어렵다 경이롭다 짙다 맑다 붉다 힘드다 묘하다 빠르다 달갑다 번거롭다 밝다 변함없다 낮다 가깝다 남다르다 얕다 덥다 깊다 환하다 반갑다 정겹다 수많다 멀다 춥다 손쉽다 새롭다 귀엽다 아름답다 뛰어나다 안타깝다 재미있다 멋지다 뜨겁다 즐겁다 정신없다
스포원파크 경륜장,2,싸다 무섭다 틀림없다 알차다 싫다 멋있다 시끄럽다 놀랍다 급하다 드넓다 재미나다 가볍다 엄청나다 힘겹다 어렵다 가까우다 맑다 비싸다 빠르다 경사지다 과하다 커다랗다 아깝다 거세다 번거롭다 밝다 가깝다 얕다 덥다 깊다 빨갛다 반갑다 멀다 춥다 매끄럽다 손쉽다 속상하다 낫다 아름답다 낡다 뜻깊다 재미있다 귀엽다 멋지다 이쁘다 즐겁다
[부산 갈맷길 2코스] 2구간 민락교~오륙도,2,예뻤다 끊임없다 재빠르다 무섭다 눈부시다 싫다 멋있다 급하다 드넓다 가볍다 쨍하다 젊다 어렵다 맑다 붉다 드물다 비싸다 버겁다 매섭다 차갑다 빠르다 귀하다 과하다 뿌옇다 아깝다 낮다 이쁘다 파랗다 기막히다 빡세다 그립다 가깝다 좁다 힘차다 덥다 얕다 깊다 야무지다 반갑다 약하다 수많다 멀다 훤하다 춥다 적다 새롭다 엄청나다 아름답다 낫다 고르다 낡다 재미있다 멋지다 뜨겁다 무덥다 즐겁다
해양스포츠교실,2,싸다 무섭다 싫다 미끄럽다 슬프다 무겁다 즐겁다 가볍다 활기차다 낯설다 하얗다 젊다 힘겹다 어렵다 맑다 지겨우다 드물다 빡시다 빠르다 쎄다 아깝다 낮다 어려우다 밝다 파랗다 가깝다 희다 얕다 힘차다 덥다 좁다 깊다 반갑다 수많다 멀다 새롭다 귀엽다 아름답다 안타깝다 뜻깊다 재미있다 색다르다 멋지다 이쁘다 어지럽다
회동수원지 둘레길,2,기쁘다 익다 무섭다 알차다 싫다 곱다 가볍다 예뿌다 앙증맞다 어렵다 느리다 가까우다 젊다 푸르다 맑다 붉다 빡시다 매섭다 빠르다 과하다 낮다 밝다 파랗다 가깝다 남다르다 뜨겁다 좁다 덥다 깊다 야무지다 반갑다 멀다 춥다 적다 아름답다 고르다 멋지다 이쁘다 즐겁다
해안누리길 몰운대길,2,비좁다 기쁘다 눈부시다 싫다 걸맞다 멋있다 정답다 급하다 드넓다 가볍다 사이좋다 젊다 어렵다 아쉬우다 더럽다 짙다 맑다 붉다 드물다 비싸다 차갑다 묘하다 힘드다 빠르다 덩그러다 세차다 쎄다 거세다 낮다 밝다 보드랍다 파랗다 가깝다 얕다 좁다 덥다 깊다 환하다 야무지다 부끄럽다 정겹다 멀다 춥다 적다 새롭다 수많다 아름답다 낫다 엄청나다 낡다 재미있다 어이없다 색다르다 멋지다 이쁘다 푸르르다 즐겁다 주의깊다 넓디넓다
대저캠핑장,2,싸다 싫다 멋있다 곱다 촌스럽다 급하다 인상깊다 노랗다 낯설다 엄청나다 젊다 못지않다 어렵다 차다 벌겋다 가까우다 푸르다 맑다 드물다 비싸다 빠르다 박하다 낮다 밝다 파랗다 가깝다 희다 뜨겁다 좁다 덥다 손색없다 부끄럽다 노오랗다 반갑다 수많다 멀다 알맞다 적다 매끄럽다 새롭다 곧다 귀엽다 아름답다 뛰어나다 어설프다 재미있다 멋지다 이쁘다 재미없다 정신없다
동래 베네스트 골프클럽,2,알차다 싫다 멋있다 시끄럽다 놀랍다 가볍다 아낌없다 젊다 힘겹다 어렵다 아쉬우다 느리다 힘드다 비싸다 드물다 빠르다 쎄다 어둡다 낮다 어려우다 가깝다 좁다 깊다 반갑다 수많다 멀다 알맞다 적다 매끄럽다 손쉽다 새롭다 곧다 귀엽다 아름답다 찹다 뛰어나다 즐거다 재미있다 멋지다 이쁘다 즐겁다 정신없다
화명수상레포츠타운,2,싸다 비좁다 기쁘다 습하다 무섭다 알차다 싫다 멋있다 놀랍다 무겁다 슬프다 급하다 가볍다 젊다 어렵다 느리다 차다 따갑다 맑다 차갑다 힘드다 빠르다 과하다 쎄다 커다랗다 아깝다 바르다 낮다 이쁘다 가깝다 빡세다 요상하다 힘차다 덥다 좁다 깊다 부끄럽다 반갑다 약하다 수많다 멀다 춥다 뼈저리다 새롭다 엄청나다 낫다 고르다 재미있다 쓸데없다 멋지다 뜨겁다 색다르다 재미없다 즐겁다 넓디넓다
삼락수상레포츠타운,2,싸다 습하다 재빠르다 무섭다 알차다 싫다 멋있다 이롭다 급하다 드넓다 가볍다 젊다 험하다 어렵다 아쉬우다 차다 따갑다 맑다 차갑다 드물다 힘드다 빠르다 폭넓다 과하다 쎄다 아깝다 낮다 이쁘다 밝다 가깝다 힘차다 덥다 좁다 동그랗다 야무지다 반갑다 수많다 멀다 춥다 알맞다 적다 손쉽다 두껍다 귀엽다 낫다 아름답다 고르다 뛰어나다 재미있다 색다르다 멋지다 뜨겁다 즐겁다 무겁다
남파랑길(부산),2,무섭다 눈부시다 알차다 싫다 걸맞다 귀여우다 멋있다 곱다 서글프다 급하다 인상깊다 드넓다 가볍다 낯설다 외롭다 엄청나다 젊다 험하다 어렵다 느리다 짙다 맑다 붉다 힘드다 빠르다 달갑다 과하다 뿌옇다 번거롭다 이쁘다 어려우다 밝다 가깝다 그립다 거칠다 좁다 덥다 얕다 깊다 야무지다 반갑다 아름다우다 가파르다 수많다 멀다 춥다 알맞다 적다 새롭다 흔하다 귀엽다 아름답다 안타깝다 고르다 굳세다 재미있다 어이없다 쓸데없다 멋지다 뜨겁다 색다르다 무덥다 즐겁다 넓디넓다
태종대스쿠버다이빙,2,싸다 기쁘다 무섭다 싫다 걸맞다 오래다 멋있다 두렵다 놀랍다 무겁다 슬프다 탁하다 드넓다 쨍하다 사이좋다 젊다 어렵다 느리다 차다 따갑다 해맑다 맑다 힘드다 드물다 비싸다 빠르다 귀하다 어둡다 바르다 밝다 가깝다 빡세다 그립다 거칠다 남다르다 얕다 좁다 깊다 잽싸다 야무지다 반갑다 멀다 춥다 까맣다 줄기차다 적다 고우다 수많다 귀엽다 아름답다 엄청나다 누리다 재미있다 멋지다 이쁘다 즐겁다
부산어린이워터파크_키득키득파크,2,싸다 예뻤다 무섭다 알차다 싫다 귀여우다 멋있다 미끄럽다 추우다 문제없다 드넓다 가볍다 낯설다 엄청나다 험하다 어렵다 더럽다 따갑다 푸르다 맑다 비싸다 차갑다 빠르다 숨차다 높다랗다 아깝다 낮다 이쁘다 밝다 파랗다 빡세다 가깝다 희다 동그랗다 얕다 좁다 덥다 깊다 환하다 반갑다 가파르다 멀다 춥다 올곧다 적다 새롭다 안타깝다 낫다 낡다 재미있다 어이없다 귀엽다 멋지다 뜨겁다 푸르르다 재미없다 즐겁다
화명생태공원(산악자전거),2,싸다 무섭다 싫다 오래다 멋있다 시끄럽다 놀랍다 급하다 가볍다 활기차다 휑하다 젊다 어렵다 아쉬우다 해맑다 푸르다 맑다 붉다 매섭다 빠르다 어둡다 시리다 밝다 가깝다 그립다 덥다 깊다 환하다 야무지다 수많다 멀다 춥다 엄청나다 귀엽다 아름답다 재미있다 멋지다 이쁘다 즐겁다 넓디넓다
부산해양치유프로그램(해운대),2,무섭다 알차다 싫다 걸맞다 멋있다 슬프다 급하다 인상깊다 외롭다 사이좋다 씨다 가파르다 젊다 못지않다 어렵다 벅차다 푸르다 맑다 붉다 비싸다 빠르다 어둡다 아깝다 이쁘다 어려우다 심심찮다 밝다 빡세다 가깝다 얕다 힘차다 덥다 빨갛다 깊다 환하다 부끄럽다 약하다 춥다 까맣다 적다 새롭다 수많다 귀엽다 곧다 아름답다 두껍다 뛰어나다 재미있다 멋지다 뜨겁다 재미없다 후하다 즐겁다 정신없다
부산해양치유프로그램(광안리),2,습하다 무섭다 알차다 싫다 걸맞다 추우다 멋있다 무겁다 슬프다 급하다 재미나다 가볍다 외롭다 씨다 젊다 못지않다 어렵다 더럽다 징그럽다 푸르다 맑다 붉다 비싸다 힘드다 빠르다 이쁘다 어려우다 심심찮다 밝다 빡세다 얕다 힘차다 덥다 빨갛다 깊다 환하다 부끄럽다 약하다 가파르다 수많다 멀다 까맣다 춥다 새롭다 곧다 귀엽다 아름답다 두껍다 뛰어나다 엄청나다 뜻깊다 재미있다 멋지다 뜨겁다 재미없다 후하다 즐겁다 정신없다
부산해양치유프로그램(다대포),2,싸다 재빠르다 무섭다 눈부시다 알차다 싫다 멋있다 놀랍다 급하다 즐겁다 가볍다 낯설다 외롭다 엄청나다 젊다 어렵다 벅차다 징그럽다 푸르다 맑다 붉다 비싸다 빠르다 어둡다 낮다 이쁘다 어려우다 심심찮다 밝다 가깝다 얕다 힘차다 덥다 좁다 깊다 야무지다 환하다 부끄럽다 약하다 가파르다 멀다 춥다 적다 손쉽다 새롭다 곧다 아름답다 뛰어나다 안타깝다 어설프다 낡다 재미있다 귀엽다 멋지다 뜨겁다 재미없다 어지럽다
부산태권도체험,2,싸다 무섭다 알차다 싫다 귀여우다 멋있다 특출나다 두렵다 슬프다 구리다 급하다 인상깊다 재미나다 가볍다 젊다 어렵다 느리다 나긋나긋하다 푸르다 맑다 해맑다 힘드다 빠르다 드세다 서럽다 낮다 밝다 가깝다 동그랗다 좁다 덥다 깊다 부끄럽다 야무지다 반갑다 친하다 약하다 멀다 춥다 적다 새롭다 아름답다 재미있다 어이없다 귀엽다 쓸데없다 이쁘다 멋지다 즐겁다 무겁다
삼락생태공원오토캠핑장,2,비좁다 재빠르다 알차다 싫다 멋있다 시끄럽다 곱다 촌스럽다 사납다 구리다 급하다 드넓다 가볍다 예뿌다 낯설다 젊다 못지않다 어렵다 더럽다 가까우다 푸르다 맑다 붉다 비싸다 빡시다 빠르다 과하다 박하다 파랗다 밝다 가깝다 빡세다 좁다 덥다 깊다 친하다 야무지다 반갑다 멀다 춥다 알맞다 적다 새롭다 아름답다 낫다 뜻깊다 재미있다 귀엽다 멋지다 이쁘다 서툴다 즐겁다 정신없다
범어사 템플스테이,2,예뻤다 습하다 값지다 무섭다 쩔다 눈부시다 알차다 싫다 멋있다 두렵다 놀랍다 구리다 급하다 가볍다 낯설다 어렵다 느리다 차다 징그럽다 짙다 푸르다 맑다 붉다 드물다 비싸다 빠르다 섭하다 세차다 어둡다 낮다 이쁘다 어려우다 밝다 가깝다 얕다 힘차다 덥다 좁다 깊다 야무지다 반갑다 수많다 멀다 훤하다 춥다 적다 손쉽다 엄청나다 귀엽다 아름답다 찹다 뜻깊다 재미있다 멋지다 뜨겁다 즐겁다 정신없다
부산자연곤충마을,2,지겹다 알차다 싫다 멋있다 슬프다 급하다 즐겁다 활기차다 못지않다 험하다 부시다 어렵다 징그럽다 짙다 맑다 빠르다 커다랗다 어둡다 낮다 파랗다 노랗다 뜨겁다 좁다 덥다 깊다 멀다 알맞다 적다 새롭다 수많다 아름답다 낫다 더우다 고르다 재미있다 귀엽다 멋지다 이쁘다 무덥다 어지럽다
금정산성축제,2,싸다 알차다 싫다 멋있다 흥겹다 시끄럽다 노랗다 가볍다 젊다 못지않다 시뻘겋다 어렵다 느리다 차다 푸르다 맑다 드물다 붉다 비싸다 묘하다 빠르다 쎄다 아깝다 낮다 밝다 빡세다 거칠다 얕다 덥다 깊다 빨갛다 잽싸다 야무지다 아름다우다 정겹다 까맣다 적다 새롭다 아름답다 고르다 재미있다 귀엽다 쓸데없다 멋지다 즐겁다
삼광사연등축제,2,무섭다 싫다 멋있다 시끄럽다 놀랍다 슬프다 급하다 가볍다 예뿌다 엄청나다 하얗다 어렵다 가까우다 경이롭다 짙다 맑다 붉다 차갑다 묘하다 빠르다 과하다 어둡다 어려우다 밝다 빡세다 좁다 깊다 밤늦다 환하다 야무지다 반갑다 아름다우다 수많다 멀다 훤하다 춥다 적다 새롭다 귀엽다 낫다 아름답다 흉하다 색다르다 멋지다 이쁘다 즐겁다 정신없다
부산항축제,2,습하다 재빠르다 무섭다 알차다 싫다 걸맞다 멋있다 시끄럽다 두렵다 무겁다 급하다 드넓다 가볍다 뻔하다 낯설다 쨍하다 하얗다 젊다 힘겹다 어렵다 따시다 짙다 푸르다 맑다 붉다 비싸다 묘하다 빠르다 폭넓다 아깝다 낮다 이쁘다 어려우다 밝다 가깝다 거칠다 좁다 덥다 깊다 빨갛다 수많다 멀다 까맣다 춥다 짠하다 곧다 귀엽다 아름답다 엄청나다 더우다 고르다 낡다 뜻깊다 재미있다 색다르다 멋지다 뜨겁다 즐겁다 우습다
동래읍성 역사축제,2,싸다 무섭다 알차다 싫다 걸맞다 멋있다 인상깊다 가볍다 젊다 어렵다 해맑다 맑다 붉다 비싸다 빡시다 빠르다 폭넓다 밝다 가깝다 좁다 덥다 깊다 야물딱지다 야무지다 반갑다 가파르다 수많다 멀다 적다 흥겹다 엄청나다 귀엽다 낫다 가엾다 아름답다 고르다 낡다 재미있다 색다르다 멋지다 이쁘다 즐겁다
부산비엔날레,2,무섭다 알차다 걸맞다 멋있다 시끄럽다 무겁다 슬프다 급하다 인상깊다 가볍다 낯설다 엄청나다 젊다 험하다 어렵다 가까우다 짙다 푸르다 맑다 붉다 비싸다 차갑다 묘하다 빠르다 귀하다 과하다 뿌옇다 커다랗다 아깝다 연하다 어둡다 낮다 이쁘다 어려우다 밝다 가깝다 거칠다 좁다 덥다 깊다 야무지다 반갑다 수많다 멀다 춥다 적다 새롭다 귀엽다 아름답다 찹다 뛰어나다 낡다 뜻깊다 재미있다 멋지다 뜨겁다 즐겁다
광안리어방축제,2,싸다 기쁘다 재빠르다 눈부시다 알차다 싫다 귀여우다 멋있다 추우다 급하다 가볍다 엄청나다 젊다 오래다 어렵다 비싸다 덩그러다 빠르다 섭하다 옛스럽다 밝다 덥다 깊다 환하다 야무지다 아름다우다 멀다 춥다 적다 새롭다 수많다 귀엽다 아름답다 안타깝다 재미있다 멋지다 이쁘다 재미없다 즐겁다
부산국제록페스티벌,2,기쁘다 습하다 쩔다 알차다 싫다 귀여우다 오래다 멋있다 시끄럽다 놀랍다 슬프다 급하다 하얗다 젊다 어렵다 느리다 경이롭다 맑다 비싸다 빠르다 어둡다 파랗다 이쁘다 밝다 가깝다 빡세다 남다르다 힘차다 덥다 손색없다 좁다 깊다 야무지다 반갑다 수많다 멀다 춥다 적다 매끄럽다 새롭다 엄청나다 귀엽다 낫다 아름답다 조그맣다 뜻깊다 재미있다 멋지다 뜨겁다 즐겁다
낙동강유채꽃축제,2,무섭다 알차다 흐드러지다 생뚱맞다 싫다 걸맞다 멋있다 곱다 샛노랗다 슬프다 노랗다 드넓다 가볍다 앙증맞다 엄청나다 젊다 어렵다 맑다 붉다 드물다 가까우다 빠르다 귀하다 새하얗다 낮다 밝다 가깝다 뜨겁다 힘차다 덥다 좁다 깊다 환하다 반갑다 정겹다 수많다 멀다 춥다 적다 귀엽다 낫다 아름답다 고르다 안타깝다 재미있다 멋지다 이쁘다 재미없다 넓디넓다
대저토마토축제,2,검붉다 무섭다 알차다 싫다 멋있다 곱다 샛노랗다 무겁다 급하다 노랗다 드넓다 예뿌다 어렵다 따갑다 짙다 맑다 붉다 드물다 비싸다 매섭다 빠르다 귀하다 어둡다 낮다 밝다 가깝다 그립다 얕다 좁다 덥다 빨갛다 깊다 야무지다 반갑다 잽싸다 부끄럽다 수많다 멀다 알맞다 적다 매끄럽다 엄청나다 귀엽다 아름답다 뛰어나다 재미있다 어이없다 멋지다 이쁘다 서툴다 볼품없다 즐겁다
삼락벚꽃축제,2,싸다 눈부시다 지겹다 알차다 흐드러지다 생뚱맞다 싫다 멋있다 곱다 급하다 노랗다 드넓다 가볍다 예뿌다 쨍하다 엄청나다 하얗다 젊다 못지않다 어렵다 가까우다 짙다 맑다 붉다 드물다 힘드다 빠르다 새하얗다 어둡다 낮다 어려우다 밝다 가깝다 우중충하다 그립다 좁다 덥다 깊다 여리다 야무지다 수많다 멀다 춥다 적다 매끄럽다 안타깝다 새롭다 귀엽다 낫다 아름답다 멋지다 이쁘다
부산푸드필름페스타,2,기쁘다 습하다 끊임없다 알차다 싫다 멋있다 곱다 문제없다 급하다 인상깊다 재미나다 가볍다 엄청나다 젊다 어렵다 가까우다 따갑다 맑다 그럴싸하다 비싸다 남부럽다 덩그러다 빠르다 낮다 밝다 뜨거우다 뜨겁다 힘차다 덥다 깊다 야무지다 반갑다 멀다 적다 짠하다 수많다 새롭다 흥겹다 더우다 재미있다 귀엽다 멋지다 이쁘다 후하다 즐겁다
강서낙동강변30리벚꽃축제,2,고달프다 무섭다 흐드러지다 싫다 멋있다 시끄럽다 곱다 무겁다 급하다 노랗다 드넓다 가볍다 예뿌다 앙증맞다 엄청나다 오래다 어렵다 짙다 맑다 붉다 빡시다 매섭다 빠르다 어둡다 낮다 밝다 가깝다 좁다 깊다 부끄럽다 멀다 춥다 적다 새롭다 수많다 귀엽다 아름답다 안타깝다 멋지다 이쁘다 즐겁다 정신없다 넓디넓다
금정산성축제,2,싸다 알차다 싫다 멋있다 흥겹다 시끄럽다 노랗다 가볍다 젊다 못지않다 시뻘겋다 어렵다 느리다 차다 푸르다 맑다 드물다 붉다 비싸다 묘하다 빠르다 쎄다 아깝다 낮다 밝다 빡세다 거칠다 얕다 덥다 깊다 빨갛다 잽싸다 야무지다 아름다우다 정겹다 까맣다 적다 새롭다 아름답다 고르다 재미있다 귀엽다 쓸데없다 멋지다 즐겁다
수국꽃문화축제,2,흔하다 싸다 습하다 무섭다 틀림없다 알차다 싫다 추우다 오래다 멋있다 시끄럽다 수줍다 슬프다 급하다 드넓다 가볍다 예뿌다 휑하다 하얗다 젊다 어렵다 아쉬우다 짙다 맑다 붉다 푸르다 힘드다 빠르다 뿌옇다 세차다 어둡다 드높다 파랗다 이쁘다 밝다 가깝다 빡세다 좁다 덥다 얕다 깊다 반갑다 아름다우다 가파르다 멀다 적다 손쉽다 새롭다 수많다 귀엽다 아름답다 안타깝다 더우다 순하다 낡다 어설프다 재미있다 어이없다 멋지다 뜨겁다 즐겁다 정신없다
서면메디컬스트리트축제,2,비좁다 기쁘다 무섭다 지겹다 알차다 싫다 멋있다 시끄럽다 슬프다 즐겁다 가볍다 낯설다 외지다 하얗다 젊다 못지않다 밉다 어렵다 만만찮다 차다 맑다 붉다 비싸다 덩그러다 빠르다 경사지다 귀하다 낮다 밝다 가깝다 좁다 덥다 깊다 부끄럽다 야무지다 반갑다 수많다 멀다 춥다 알맞다 적다 손쉽다 새롭다 엄청나다 귀엽다 아름답다 재미있다 멋지다 이쁘다 어지럽다 정신없다 주의깊다
연제고분판타지축제,2,흐드러지다 싫다 걸맞다 멋있다 노랗다 가볍다 앙증맞다 엄청나다 휑하다 젊다 못지않다 어렵다 해맑다 맑다 빡시다 빠르다 아깝다 서럽다 밝다 가깝다 좁다 덥다 환하다 빨갛다 반갑다 멀다 춥다 적다 아름답다 낫다 안타깝다 재미있다 귀엽다 멋지다 이쁘다 즐겁다